{
  "$schema": "https://json-schema.org/draft/2020-12/schema",
  "title": "Watch Price History",
  "description": "Brand-neutral append-only price and listing-status changes for one brand in one market.",
  "type": "object",
  "additionalProperties": false,
  "required": ["$schema", "schemaVersion", "brandId", "marketCode", "currencyCode", "priceType", "taxRatePercent", "collectionRuns", "priceSeries"],
  "properties": {
    "$schema": { "const": "../../schemas/watch-price-history.schema.json" },
    "schemaVersion": { "const": 4 },
    "brandId": { "$ref": "#/$defs/slug" },
    "marketCode": { "type": "string", "pattern": "^[A-Z]{2}$" },
    "currencyCode": { "type": "string", "pattern": "^[A-Z]{3}$" },
    "priceType": { "enum": ["tax-include", "tax-exclude", "no-tax"] },
    "taxRatePercent": { "type": ["number", "null"], "minimum": 0, "maximum": 100 },
    "collectionRuns": {
      "type": "array",
      "minItems": 1,
      "items": { "$ref": "#/$defs/collectionRun" }
    },
    "priceSeries": {
      "type": "object",
      "minProperties": 1,
      "propertyNames": { "$ref": "#/$defs/watchId" },
      "additionalProperties": {
        "type": "array",
        "minItems": 1,
        "items": { "$ref": "#/$defs/pricePoint" }
      }
    }
  },
  "$defs": {
    "slug": { "type": "string", "pattern": "^[a-z0-9]+(?:-[a-z0-9]+)*$" },
    "watchId": { "type": "string", "pattern": "^[a-z0-9]+(?:-[a-z0-9]+)*:.+$" },
    "collectionRun": {
      "type": "object",
      "additionalProperties": false,
      "required": ["runId", "collectedAt", "recordCount"],
      "properties": {
        "runId": { "type": "integer", "minimum": 1 },
        "collectedAt": { "type": "string", "format": "date-time" },
        "recordCount": { "type": "integer", "minimum": 0 }
      }
    },
    "pricePoint": {
      "type": "object",
      "additionalProperties": false,
      "required": ["runId", "listingStatus", "price"],
      "properties": {
        "runId": { "type": "integer", "minimum": 1 },
        "listingStatus": { "enum": ["listed", "retailer-only", "price-unavailable", "not-listed"] },
        "price": { "type": ["integer", "null"], "minimum": 0 }
      },
      "allOf": [
        {
          "if": { "properties": { "listingStatus": { "enum": ["listed", "retailer-only"] } } },
          "then": { "properties": { "price": { "type": "integer", "minimum": 0 } } }
        },
        {
          "if": { "properties": { "listingStatus": { "enum": ["price-unavailable", "not-listed"] } } },
          "then": { "properties": { "price": { "type": "null" } } }
        }
      ]
    }
  }
}
