{
  "$schema": "../../schemas/watch-price-history.schema.json",
  "schemaVersion": 4,
  "brandId": "omega",
  "marketCode": "ES",
  "currencyCode": "EUR",
  "priceType": "tax-include",
  "taxRatePercent": 21,
  "collectionRuns": [
    {
      "runId": 1,
      "collectedAt": "2026-09-20T17:29:15.343Z",
      "recordCount": 552
    },
    {
      "runId": 2,
      "collectedAt": "2026-10-11T10:42:50Z",
      "recordCount": 563
    },
    {
      "runId": 3,
      "collectedAt": "2026-10-11T13:31:49Z",
      "recordCount": 563
    }
  ],
  "priceSeries": {
    "omega:131.10.25.60.02.002": [
      {
        "runId": 1,
        "listingStatus": "listed",
        "price": 3300
      },
      {
        "runId": 3,
        "listingStatus": "retailer-only",
        "price": 3300
      }
    ],
    "omega:131.10.25.60.52.001": [
      {
        "runId": 1,
        "listingStatus": "listed",
        "price": 4000
      }
    ],
    "omega:131.10.25.60.53.001": [
      {
        "runId": 1,
        "listingStatus": "listed",
        "price": 5800
      },
      {
        "runId": 3,
        "listingStatus": "retailer-only",
        "price": 5800
      }
    ],
    "omega:131.10.28.60.01.001": [
      {
        "runId": 1,
        "listingStatus": "listed",
        "price": 3400
      },
      {
        "runId": 3,
        "listingStatus": "retailer-only",
        "price": 3400
      }
    ],
    "omega:131.10.28.60.02.002": [
      {
        "runId": 1,
        "listingStatus": "listed",
        "price": 3400
      }
    ],
    "omega:131.10.28.60.03.001": [
      {
        "runId": 1,
        "listingStatus": "listed",
        "price": 3500
      }
    ],
    "omega:131.10.28.60.03.002": [
      {
        "runId": 1,
        "listingStatus": "listed",
        "price": 3400
      }
    ],
    "omega:131.10.28.60.05.001": [
      {
        "runId": 1,
        "listingStatus": "listed",
        "price": 3800
      }
    ],
    "omega:131.10.28.60.11.001": [
      {
        "runId": 1,
        "listingStatus": "listed",
        "price": 3500
      }
    ],
    "omega:131.10.28.60.52.001": [
      {
        "runId": 1,
        "listingStatus": "listed",
        "price": 4300
      }
    ],
    "omega:131.10.28.60.55.001": [
      {
        "runId": 1,
        "listingStatus": "listed",
        "price": 4700
      }
    ],
    "omega:131.10.28.60.60.001": [
      {
        "runId": 1,
        "listingStatus": "listed",
        "price": 4400
      }
    ],
    "omega:131.10.28.60.60.002": [
      {
        "runId": 1,
        "listingStatus": "listed",
        "price": 4400
      }
    ],
    "omega:131.10.29.20.52.001": [
      {
        "runId": 1,
        "listingStatus": "listed",
        "price": 8300
      }
    ],
    "omega:131.10.29.20.55.001": [
      {
        "runId": 1,
        "listingStatus": "listed",
        "price": 8700
      },
      {
        "runId": 3,
        "listingStatus": "retailer-only",
        "price": 8700
      }
    ],
    "omega:131.10.34.20.02.001": [
      {
        "runId": 1,
        "listingStatus": "listed",
        "price": 7800
      }
    ],
    "omega:131.10.34.20.53.001": [
      {
        "runId": 1,
        "listingStatus": "listed",
        "price": 9200
      }
    ],
    "omega:131.10.36.60.01.001": [
      {
        "runId": 1,
        "listingStatus": "listed",
        "price": 3300
      }
    ],
    "omega:131.10.39.20.02.001": [
      {
        "runId": 1,
        "listingStatus": "listed",
        "price": 7300
      }
    ],
    "omega:131.10.39.20.06.001": [
      {
        "runId": 1,
        "listingStatus": "listed",
        "price": 7300
      }
    ],
    "omega:131.12.41.21.06.001": [
      {
        "runId": 1,
        "listingStatus": "listed",
        "price": 7100
      }
    ],
    "omega:131.15.25.60.53.002": [
      {
        "runId": 1,
        "listingStatus": "listed",
        "price": 8700
      }
    ],
    "omega:131.15.25.60.55.001": [
      {
        "runId": 1,
        "listingStatus": "listed",
        "price": 7300
      }
    ],
    "omega:131.15.25.60.55.002": [
      {
        "runId": 1,
        "listingStatus": "listed",
        "price": 8100
      }
    ],
    "omega:131.15.25.60.99.001": [
      {
        "runId": 1,
        "listingStatus": "listed",
        "price": 9400
      }
    ],
    "omega:131.15.28.60.01.001": [
      {
        "runId": 1,
        "listingStatus": "listed",
        "price": 6700
      }
    ],
    "omega:131.15.28.60.02.001": [
      {
        "runId": 1,
        "listingStatus": "listed",
        "price": 6700
      }
    ],
    "omega:131.15.28.60.11.001": [
      {
        "runId": 1,
        "listingStatus": "listed",
        "price": 6700
      }
    ],
    "omega:131.15.28.60.60.001": [
      {
        "runId": 1,
        "listingStatus": "listed",
        "price": 8300
      }
    ],
    "omega:131.15.28.60.99.001": [
      {
        "runId": 1,
        "listingStatus": "listed",
        "price": 10100
      }
    ],
    "omega:131.15.29.20.53.001": [
      {
        "runId": 1,
        "listingStatus": "listed",
        "price": 13800
      }
    ],
    "omega:131.15.29.20.60.001": [
      {
        "runId": 1,
        "listingStatus": "listed",
        "price": 12900
      }
    ],
    "omega:131.15.29.20.99.001": [
      {
        "runId": 1,
        "listingStatus": "listed",
        "price": 14400
      }
    ],
    "omega:131.18.29.20.60.001": [
      {
        "runId": 1,
        "listingStatus": "listed",
        "price": 12600
      }
    ],
    "omega:131.20.25.60.55.001": [
      {
        "runId": 1,
        "listingStatus": "listed",
        "price": 7100
      }
    ],
    "omega:131.20.25.60.55.002": [
      {
        "runId": 1,
        "listingStatus": "listed",
        "price": 7100
      }
    ],
    "omega:131.20.28.60.05.001": [
      {
        "runId": 1,
        "listingStatus": "listed",
        "price": 6600
      }
    ],
    "omega:131.20.28.60.05.002": [
      {
        "runId": 1,
        "listingStatus": "listed",
        "price": 6600
      },
      {
        "runId": 3,
        "listingStatus": "retailer-only",
        "price": 6600
      }
    ],
    "omega:131.20.28.60.52.001": [
      {
        "runId": 1,
        "listingStatus": "listed",
        "price": 7100
      }
    ],
    "omega:131.20.28.60.52.002": [
      {
        "runId": 1,
        "listingStatus": "listed",
        "price": 7100
      }
    ],
    "omega:131.20.28.60.55.001": [
      {
        "runId": 1,
        "listingStatus": "listed",
        "price": 7500
      }
    ],
    "omega:131.20.28.60.55.002": [
      {
        "runId": 1,
        "listingStatus": "listed",
        "price": 7500
      }
    ],
    "omega:131.20.28.60.58.001": [
      {
        "runId": 1,
        "listingStatus": "listed",
        "price": 7100
      }
    ],
    "omega:131.20.28.60.63.001": [
      {
        "runId": 1,
        "listingStatus": "listed",
        "price": 7100
      }
    ],
    "omega:131.20.29.20.02.002": [
      {
        "runId": 1,
        "listingStatus": "listed",
        "price": 11100
      }
    ],
    "omega:131.20.29.20.05.001": [
      {
        "runId": 1,
        "listingStatus": "listed",
        "price": 11400
      }
    ],
    "omega:131.20.29.20.05.002": [
      {
        "runId": 1,
        "listingStatus": "listed",
        "price": 11400
      }
    ],
    "omega:131.20.29.20.52.001": [
      {
        "runId": 1,
        "listingStatus": "listed",
        "price": 12300
      }
    ],
    "omega:131.20.29.20.52.002": [
      {
        "runId": 1,
        "listingStatus": "listed",
        "price": 12300
      }
    ],
    "omega:131.20.29.20.53.002": [
      {
        "runId": 1,
        "listingStatus": "listed",
        "price": 14500
      }
    ],
    "omega:131.20.29.20.55.001": [
      {
        "runId": 1,
        "listingStatus": "listed",
        "price": 12600
      }
    ],
    "omega:131.20.29.20.55.002": [
      {
        "runId": 1,
        "listingStatus": "listed",
        "price": 12600
      }
    ],
    "omega:131.20.29.20.58.001": [
      {
        "runId": 1,
        "listingStatus": "listed",
        "price": 12300
      }
    ],
    "omega:131.20.34.20.63.001": [
      {
        "runId": 1,
        "listingStatus": "listed",
        "price": 14400
      }
    ],
    "omega:131.20.36.60.02.002": [
      {
        "runId": 1,
        "listingStatus": "listed",
        "price": 7300
      }
    ],
    "omega:131.20.39.20.02.001": [
      {
        "runId": 1,
        "listingStatus": "listed",
        "price": 12800
      }
    ],
    "omega:131.20.39.20.02.002": [
      {
        "runId": 1,
        "listingStatus": "listed",
        "price": 12800
      }
    ],
    "omega:131.20.39.20.52.001": [
      {
        "runId": 1,
        "listingStatus": "listed",
        "price": 15000
      }
    ],
    "omega:131.20.39.20.52.002": [
      {
        "runId": 1,
        "listingStatus": "listed",
        "price": 15000
      }
    ],
    "omega:131.20.39.20.58.001": [
      {
        "runId": 1,
        "listingStatus": "listed",
        "price": 15000
      }
    ],
    "omega:131.23.41.21.03.001": [
      {
        "runId": 1,
        "listingStatus": "listed",
        "price": 11400
      }
    ],
    "omega:131.23.41.21.06.001": [
      {
        "runId": 1,
        "listingStatus": "listed",
        "price": 11400
      }
    ],
    "omega:131.23.41.21.06.002": [
      {
        "runId": 1,
        "listingStatus": "listed",
        "price": 11400
      }
    ],
    "omega:131.23.41.21.10.001": [
      {
        "runId": 1,
        "listingStatus": "listed",
        "price": 11400
      }
    ],
    "omega:131.23.41.21.11.001": [
      {
        "runId": 1,
        "listingStatus": "listed",
        "price": 11400
      }
    ],
    "omega:131.25.25.60.55.001": [
      {
        "runId": 1,
        "listingStatus": "listed",
        "price": 10400
      }